{
  "description_schema": 1,
  "abi": 1,
  "library": {
    "stem": "libchtypes",
    "prefix": "chs_"
  },
  "scalars": [
    "void",
    "int",
    "int32",
    "uint32",
    "int64",
    "uint64",
    "size",
    "u8ptr_const",
    "cstr_static"
  ],
  "handles": {
    "chs_buf": {
      "free": "chs_buf_free",
      "holds": []
    },
    "chs_error": {
      "free": "chs_error_free",
      "holds": []
    },
    "chs_schema": {
      "free": "chs_schema_free",
      "holds": []
    },
    "chs_filter": {
      "free": "chs_filter_free",
      "holds": [
        "chs_schema"
      ]
    },
    "chs_block": {
      "free": "chs_block_free",
      "holds": [
        "chs_schema"
      ]
    }
  },
  "enums": {
    "chs_status": {
      "repr": "int32",
      "closed": true,
      "frozen": true,
      "values": [
        {
          "name": "CHS_OK",
          "value": 0
        },
        {
          "name": "CHS_REJECTED",
          "value": 1
        },
        {
          "name": "CHS_DECLINED",
          "value": 2
        },
        {
          "name": "CHS_INVALID_ARGUMENT",
          "value": 3
        },
        {
          "name": "CHS_INTERNAL",
          "value": 4
        }
      ]
    },
    "chs_format": {
      "repr": "int32",
      "frozen": true,
      "fields": {
        "ch_name": "string"
      },
      "values": [
        {
          "name": "CHS_JSON_EACH_ROW",
          "value": 0,
          "ch_name": "JSONEachRow"
        },
        {
          "name": "CHS_CSV",
          "value": 1,
          "ch_name": "CSV"
        },
        {
          "name": "CHS_TSV",
          "value": 2,
          "ch_name": "TSV"
        },
        {
          "name": "CHS_VALUES",
          "value": 3,
          "ch_name": "Values"
        },
        {
          "name": "CHS_JSON_COMPACT_EACH_ROW",
          "value": 4,
          "ch_name": "JSONCompactEachRow"
        },
        {
          "name": "CHS_ROW_BINARY",
          "value": 5,
          "ch_name": "RowBinary"
        },
        {
          "name": "CHS_ROW_BINARY_WITH_DEFAULTS",
          "value": 6,
          "ch_name": "RowBinaryWithDefaults"
        },
        {
          "name": "CHS_ROW_BINARY_WITH_NAMES_AND_TYPES_AND_DEFAULTS",
          "value": 7,
          "ch_name": "RowBinaryWithNamesAndTypesAndDefaults"
        },
        {
          "name": "CHS_NATIVE",
          "value": 8,
          "ch_name": "Native"
        },
        {
          "name": "CHS_BUFFERS",
          "value": 9,
          "ch_name": "Buffers"
        },
        {
          "name": "CHS_CSV_WITH_NAMES",
          "value": 10,
          "ch_name": "CSVWithNames"
        },
        {
          "name": "CHS_TSV_WITH_NAMES",
          "value": 11,
          "ch_name": "TSVWithNames"
        }
      ]
    },
    "transform_reason": {
      "repr": "string",
      "fields": {
        "lossy": "boolean"
      },
      "fallback": "value_changed",
      "values": [
        {
          "value": "overflow_wrap",
          "lossy": true
        },
        {
          "value": "null_to_default",
          "lossy": true
        },
        {
          "value": "null_loss",
          "lossy": true
        },
        {
          "value": "decimal_truncate",
          "lossy": true
        },
        {
          "value": "date_clamp",
          "lossy": true
        },
        {
          "value": "datetime_wrap",
          "lossy": true
        },
        {
          "value": "date_shift",
          "lossy": true
        },
        {
          "value": "uuid_mangle",
          "lossy": true
        },
        {
          "value": "ip_mangle",
          "lossy": true
        },
        {
          "value": "float_precision",
          "lossy": true
        },
        {
          "value": "lossy_numeric",
          "lossy": true
        },
        {
          "value": "fixedstring_pad",
          "lossy": true
        },
        {
          "value": "emptied",
          "lossy": true
        },
        {
          "value": "element_changed",
          "lossy": true
        },
        {
          "value": "enum_coerce",
          "lossy": true
        },
        {
          "value": "value_changed",
          "lossy": true
        },
        {
          "value": "poisoned",
          "lossy": true
        },
        {
          "value": "duplicate_key_dropped",
          "lossy": true
        },
        {
          "value": "reformat",
          "lossy": false
        },
        {
          "value": "default_filled",
          "lossy": false
        },
        {
          "value": "zero_filled",
          "lossy": false
        },
        {
          "value": "default_materialized",
          "lossy": false
        },
        {
          "value": "ttl_expired",
          "lossy": true
        },
        {
          "value": "ttl_column_expired",
          "lossy": true
        }
      ]
    },
    "value_src": {
      "repr": "string",
      "fields": {
        "is_stored": "boolean"
      },
      "values": [
        {
          "value": "input",
          "is_stored": true
        },
        {
          "value": "default",
          "is_stored": true
        },
        {
          "value": "default_substituted",
          "is_stored": true
        },
        {
          "value": "default_generated",
          "is_stored": true
        },
        {
          "value": "absent",
          "is_stored": true
        },
        {
          "value": "materialized_input",
          "is_stored": true
        },
        {
          "value": "skipped",
          "is_stored": false
        },
        {
          "value": "ephemeral_input",
          "is_stored": false
        },
        {
          "value": "default_expr_unsupported",
          "is_stored": false
        },
        {
          "value": "default_volatile_unresolved",
          "is_stored": false
        },
        {
          "value": "default_pending",
          "is_stored": false
        }
      ]
    },
    "row_outcome": {
      "repr": "string",
      "fallback": "unsupported",
      "values": [
        {
          "value": "accepted"
        },
        {
          "value": "accepted_poisoned"
        },
        {
          "value": "rejected"
        },
        {
          "value": "skipped"
        },
        {
          "value": "unsupported"
        }
      ]
    },
    "batch_outcome": {
      "repr": "string",
      "fallback": "unsupported",
      "values": [
        {
          "value": "accepted"
        },
        {
          "value": "accepted_poisoned"
        },
        {
          "value": "rejected"
        },
        {
          "value": "unsupported"
        }
      ]
    },
    "filter_outcome": {
      "repr": "string",
      "fallback": "unsupported",
      "values": [
        {
          "value": "ok"
        },
        {
          "value": "rejected"
        },
        {
          "value": "unsupported"
        }
      ]
    },
    "filter_verdict": {
      "repr": "string",
      "fields": {
        "answered": "boolean"
      },
      "fallback": "d",
      "values": [
        {
          "value": "t",
          "answered": true
        },
        {
          "value": "f",
          "answered": true
        },
        {
          "value": "e",
          "answered": false
        },
        {
          "value": "d",
          "answered": false
        }
      ]
    },
    "discover_query_param": {
      "repr": "string",
      "fields": {
        "ch_type": "string"
      },
      "values": [
        {
          "value": "database",
          "ch_type": "String"
        },
        {
          "value": "table",
          "ch_type": "String"
        }
      ]
    },
    "default_kind": {
      "repr": "string",
      "values": [
        {
          "value": ""
        },
        {
          "value": "DEFAULT"
        },
        {
          "value": "MATERIALIZED"
        },
        {
          "value": "ALIAS"
        },
        {
          "value": "EPHEMERAL"
        }
      ]
    }
  },
  "constants": {
    "CHS_ABI_REVISION_TOMBSTONE": {
      "type": "int32",
      "value": 1001
    },
    "CHS_EXPORT_NONE": {
      "type": "int32",
      "value": -1
    },
    "CHS_DOC_VALUES": {
      "type": "uint32",
      "value": 1
    },
    "CHS_DOC_TRANSFORMS": {
      "type": "uint32",
      "value": 2
    },
    "CHS_DOC_DEFAULTS": {
      "type": "uint32",
      "value": 4
    },
    "CHS_DOC_ALL": {
      "type": "uint32",
      "value": 7
    }
  },
  "column_names": {
    "text": "name",
    "bytes": "name_b64",
    "bytes_encoding": "base64"
  },
  "documents": {
    "live_handles": {
      "carries_names": false,
      "schema": {
        "type": "object",
        "additionalProperties": {
          "type": "integer",
          "minimum": 0
        }
      }
    },
    "error_code_table": {
      "carries_names": false,
      "schema": {
        "type": "array",
        "items": {
          "type": "object",
          "required": [
            "code",
            "name"
          ],
          "properties": {
            "code": {
              "type": "integer"
            },
            "name": {
              "type": "string"
            }
          }
        }
      }
    },
    "schema_description": {
      "carries_names": true
    },
    "row": {
      "carries_names": true,
      "schema": {
        "$defs": {
          "span": {
            "type": "object",
            "required": [
              "off",
              "len"
            ],
            "properties": {
              "off": {
                "type": "integer",
                "minimum": 0,
                "maximum": 9007199254740991
              },
              "len": {
                "type": "integer",
                "minimum": 0,
                "maximum": 9007199254740991
              }
            }
          },
          "col": {
            "type": "object",
            "required": [
              "null"